{"algorithm":"verifyum-sha256-merkle-v1","checkpoint_hash":"sha256:bc3653e93164e62d0bc1272b2d76eace51df7951d692a3138991c144c631728c","created_at":"2026-08-31T19:06:04Z","kind":"hourly","merkle_root":"sha256:dbde1e168a15113d88b12c28192ed236d85b23ae5479812d930888e9c6664e54","network":"mainnet-beta","period_end":"2026-08-31T19:00:00Z","period_start":"2026-08-31T18:00:00Z","previous_checkpoint_hash":null,"protocol":"verifyum","schema":"https://verifyum.com/schema/witness-checkpoint-v1.json","subject_count":5,"subject_type":"proof-v2","version":1}
