{"algorithm":"verifyum-sha256-merkle-v1","checkpoint_hash":"sha256:6237cfaafaf4ad6ed3f54a4f6de7f758b7368ac1ff8bedd3e9b1f3aef0cee93a","created_at":"2026-09-01T00:18:01Z","kind":"daily","merkle_root":"sha256:3718612ac8f5c39417508a5dd7e0edf771e3de6ba560d37bff7373179858e94d","network":"mainnet-beta","period_end":"2026-09-01T00:00:00Z","period_start":"2026-08-31T00:00:00Z","previous_checkpoint_hash":null,"protocol":"verifyum","schema":"https://verifyum.com/schema/witness-checkpoint-v1.json","subject_count":2,"subject_type":"hourly-checkpoint-v1","version":1}
